{
  "$schema": "https://json-schema.org/draft/2020-12/schema",
  "$id": "https://raw.githubusercontent.com/IntelIP/Tabellio/main/schemas/agent-run-state.schema.json",
  "title": "Tabellio Agent Run State",
  "type": "object",
  "additionalProperties": false,
  "required": [
    "schemaVersion",
    "runId",
    "status",
    "repository",
    "workspace",
    "actor",
    "task",
    "notesRef",
    "checkpoints",
    "headCommit",
    "validation",
    "context",
    "completedAt",
    "promotedAt",
    "createdAt",
    "updatedAt"
  ],
  "properties": {
    "schemaVersion": { "const": "tabellio-run/v0.1" },
    "runId": { "type": "string", "pattern": "^[A-Za-z0-9][A-Za-z0-9._-]*$" },
    "status": {
      "enum": ["starting", "active", "validation_failed", "completed", "promoted"]
    },
    "repository": {
      "type": "object",
      "additionalProperties": false,
      "required": ["id", "baseRef", "baseName", "baseCommit"],
      "properties": {
        "id": { "type": "string", "minLength": 1, "not": { "pattern": "^(?:/|file:|[A-Za-z]:[\\\\/])|\\\\" } },
        "baseRef": { "type": "string", "pattern": "^refs/heads/.+" },
        "baseName": { "type": "string", "minLength": 1 },
        "baseCommit": { "$ref": "#/$defs/oid" }
      }
    },
    "workspace": {
      "type": "object",
      "additionalProperties": false,
      "required": ["branch"],
      "properties": {
        "branch": { "type": "string", "minLength": 1, "not": { "pattern": "^refs/" } }
      }
    },
    "actor": {
      "type": "object",
      "additionalProperties": false,
      "required": ["type", "id"],
      "properties": {
        "type": { "enum": ["human", "agent", "ci", "system"] },
        "id": { "type": "string", "minLength": 1 }
      }
    },
    "task": {
      "type": "object",
      "additionalProperties": false,
      "required": ["summary"],
      "properties": {
        "summary": { "type": "string", "minLength": 1 }
      }
    },
    "notesRef": { "type": "string", "pattern": "^refs/notes/.+" },
    "checkpoints": {
      "type": "array",
      "items": {
        "type": "object",
        "additionalProperties": false,
        "required": ["commit", "summary", "createdAt"],
        "properties": {
          "commit": { "$ref": "#/$defs/oid" },
          "summary": { "type": "string", "minLength": 1, "maxLength": 500 },
          "createdAt": { "$ref": "#/$defs/dateTime" }
        }
      }
    },
    "headCommit": {
      "oneOf": [{ "$ref": "#/$defs/oid" }, { "type": "null" }]
    },
    "validation": {
      "oneOf": [
        { "type": "null" },
        {
          "type": "object",
          "additionalProperties": false,
          "required": ["command", "display", "status", "exitCode", "signal", "error", "completedAt"],
          "properties": {
            "command": {
              "type": "array",
              "minItems": 1,
              "items": { "type": "string", "minLength": 1 }
            },
            "display": { "type": "string", "minLength": 1 },
            "status": { "enum": ["passed", "failed"] },
            "exitCode": { "type": ["integer", "null"] },
            "signal": { "type": ["string", "null"] },
            "error": { "type": ["string", "null"] },
            "completedAt": { "$ref": "#/$defs/dateTime" }
          }
        }
      ]
    },
    "context": {
      "oneOf": [
        { "type": "null" },
        {
          "type": "object",
          "additionalProperties": false,
          "required": ["digest", "mergeClean", "changedFileCount"],
          "properties": {
            "digest": { "type": "string", "pattern": "^[0-9a-f]{64}$" },
            "mergeClean": { "type": "boolean" },
            "changedFileCount": { "type": "integer", "minimum": 0 }
          }
        }
      ]
    },
    "completedAt": { "oneOf": [{ "$ref": "#/$defs/dateTime" }, { "type": "null" }] },
    "promotedAt": { "oneOf": [{ "$ref": "#/$defs/dateTime" }, { "type": "null" }] },
    "createdAt": { "$ref": "#/$defs/dateTime" },
    "updatedAt": { "$ref": "#/$defs/dateTime" }
  },
  "allOf": [
    {
      "if": { "properties": { "status": { "enum": ["starting", "active"] } }, "required": ["status"] },
      "then": {
        "properties": {
          "headCommit": { "type": "null" },
          "validation": { "type": "null" },
          "context": { "type": "null" },
          "completedAt": { "type": "null" },
          "promotedAt": { "type": "null" }
        }
      }
    },
    {
      "if": { "properties": { "status": { "const": "validation_failed" } }, "required": ["status"] },
      "then": {
        "properties": {
          "headCommit": { "$ref": "#/$defs/oid" },
          "validation": { "type": "object", "properties": { "status": { "const": "failed" } } },
          "context": { "type": "object" },
          "completedAt": { "type": "null" },
          "promotedAt": { "type": "null" }
        }
      }
    },
    {
      "if": { "properties": { "status": { "enum": ["completed", "promoted"] } }, "required": ["status"] },
      "then": {
        "properties": {
          "headCommit": { "$ref": "#/$defs/oid" },
          "validation": { "type": "object", "properties": { "status": { "const": "passed" } } },
          "context": { "type": "object" },
          "completedAt": { "$ref": "#/$defs/dateTime" }
        }
      }
    },
    {
      "if": { "properties": { "status": { "const": "completed" } }, "required": ["status"] },
      "then": { "properties": { "promotedAt": { "type": "null" } } }
    },
    {
      "if": { "properties": { "status": { "const": "promoted" } }, "required": ["status"] },
      "then": { "properties": { "promotedAt": { "$ref": "#/$defs/dateTime" } } }
    }
  ],
  "$defs": {
    "oid": { "type": "string", "pattern": "^(?:[0-9a-f]{40}|[0-9a-f]{64})$" },
    "dateTime": {
      "type": "string",
      "pattern": "^\\d{4}-\\d{2}-\\d{2}T\\d{2}:\\d{2}:\\d{2}(?:\\.\\d+)?(?:Z|[+-]\\d{2}:\\d{2})$"
    }
  }
}
